title,url,text
Estupor en Ucrania por la ruptura entre Trump y Zelenski en la Casa Blanca,https://elpais.com/internacional/2025-02-28/estupor-en-ucrania-por-la-ruptura-entre-trump-y-zelenski-en-la-casa-blanca.html,"Oksana Markarova se tapaba la cara con una mano mientras movía la cabeza en señal de desesperación. Esta imagen de la embajadora de Ucrania en Estados Unidos se ha convertido en el símbolo en los medios ucranios de cómo ha recibido el país invadido por Rusia lo sucedido este viernes en la Casa Blanca. Había esperanza en que el acuerdo apalabrado el día antes para la explotación de minerales ucranios entre los dos países sirviera para revertir la inquina de Donald Trump contra Volodímir Zelenski. Pero h... Las primeras reacciones aparecidas en los medios ucranios y en las redes sociales muestran la magnitud del desastre, lo que parece una ruptura irreparable entre Zelenski y Trump. ""Esto no ha sido una conferencia de prensa, esto ha sido una emboscada"", ha escrito Akash Maniam, conocido promotor del apoyo internacional a Kiev. ""Es vergonzoso. Están intentando sin ningún rubor arrodillar a Zelenski con todo lo que pueden, como si fuera una pelea de bar y no el Despacho Oval"", ha valorado Illia Ponomarenko, uno de los analistas de la guerra más populares de Ucrania. ""Nunca querían un acuerdo, punto"", ha añadido Ponomarenko, comentando el hecho de que finalmente no se firmó el tratado de cooperación económica que debía allanar el camino para proseguir con la alianza entre EE UU y Ucrania. Las palabras de este analista coinciden con la visión de múltiples voces ucranias que entienden que Trump quiere ver a Zelenski abandonar el cargo. El republicano Lindsey Graham reiteró en Wahsington que Zelenski ya no es un interlocutor válido porque ha insultado a su país. ""Es el peor momento en las relaciones bilaterales entre Ucrania y EE UU mientras Ucrania libra una guerra de existencia. ¿Cómo podemos construir una relación de beneficio mutuo si al presidente ucranio ni le escuchan y los intereses justos de Ucrania son menospreciados en público?"", se ha preguntado Mikola Bielieskov, experto del Instituto Nacional de Estudios Estratégicos, organismo dependiente de la presidencia de Ucrania. Andrii Kovalenko, miembro del Consejo de Seguridad Nacional de Ucrania, y hombre de confianza del equipo de Zelenski, ha afirmado que lo sucedido ""es historia, algo así ni ocurrió en el siglo XX"". Kovalenko ha sido una de las voces que han intentado defender con más vehemencia el argumentario oficial de la cúpula del poder en Kiev, que la llegada de un tipo duro como Trump a la Casa Blanca serviría para meter en vereda a Vladímir Putin. ""Las cosas todavía están sobre la mesa y Ucrania está defendiendo sus propios intereses en unas condiciones muy difíciles. Pero todavía todo está sobre la mesa"", ha añadido Kovalenko. ""La situación es extremadamente desagradable, estoy en shock. Estamos muy preocupados sobre hacia dónde puede ir esto"", ha afirmado en la CNN el exministro de Defensa Andrii Zagorodniuk, el primer titular de esta cartera durante la presidencia de Zelenski. Zagorodniuk opina que ha habido una actitud ""provocadora"" por parte de la Casa Blanca y que, al final, lo que se ha evidenciado es que EE UU..."
Francia ve la respuesta militar europea en Ucrania como un “laboratorio de una OTAN pos-Trump”,https://elpais.com/internacional/2025-03-28/francia-ve-la-respuesta-militar-europea-en-ucrania-como-un-laboratorio-de-una-otan-pos-trump.html,"El envío de tropas europeas a suelo ucranio tras un hipotético acuerdo de paz se ha convertido un empeño del renovado eje franco-británico. El presidente francés, Emmanuel Macron, y el primer ministro británico, Keir Starmer, empujan a sus aliados para crear una ""coalición de voluntarios"" que permita asegurar la paz en Ucrania desplegando unos 30.000 soldados en tierra, sin descartar también un contingente naval y aéreo. Francia, según una comunicación diplomática, cree que esta ex...
periencia podría constituir un ""laboratorio"" para testar las modalides de funcionamiento del pilar europeo de ""una OTAN pos-Trump"".
Las reuniones preparatorias para la cita de este jueves, en la que participaron 31 países y los líderes de la OTAN y de la UE, permitieron a los diplomáticos encargados del asunto entender mejor los planes de Francia. La idea es acompasar la acción europea a los esfuerzos estadounidenses. Macron, de hecho, habla cada dos días con el presidente Donald Trump y casi a diario con su homólogo ucranio, Volodímir Zelenski. Pero Francia considera seriamente un despliegue de tropas en Ucrania, como confirmó el propio Macron el jueves, así como en países aliados como Rumania, para reforzar su frontera con Ucrania.
La coalición de voluntarios, según las reuniones preparatorias y esta comunicación diplomática, podría estar constituida bajo el mando y control de la OTAN, y basarse en el modelo de los acuerdos Berlín Plus, adoptados en 2003 y que permiten a la Alianza apoyar operaciones dirigidas por la UE en las que no participa la OTAN en su conjunto. Naturalmente, el acuerdo debería también negociarse con la OTAN, coinciden todos sus impulsores. Pero, en cualquier caso, Francia y el Reino Unido están todavía trabajando en detectar qué países de la UE querrían participar en esta coalición militar. Los británicos, por su parte, querrían que la misión no se limitase al ámbito terrestre, sino que implicase también una cobertura aérea.
La idea de la misión sería también una forma de probar tipo de misiones realizadas por coaliciones de voluntarios europeos y apoyadas en la estructura de la OTAN. Si todo este plan avanzase, opinan fuentes diplomáticas, ""podría constituir el embrión de los futuros mecanismos de una OTAN pos-Trump"".
Macron anunció este jueves por primera vez y de forma clara que habrá ""una coalición de voluntarios"" que se desplegará en suelo ucranio para garantizar la paz tras un hipotético acuerdo. La oposición de algunos de los Estados miembro, como Alemania, Croacia o Italia, no sería un problema. ""Serán algunos países"", matizó Macron. Pero la dificultad de coordinación es enorme. Por eso podría estar constituida bajo el mando y control de la OTAN."
Últimas noticias de la guerra de Rusia y Ucrania | Putin propone sustituir a Zelenski por un Gobierno temporal auspiciado por la ONU y EE UU,https://elpais.com/internacional/2025-03-28/ultimas-noticias-de-la-guerra-de-rusia-y-ucrania.html,"EL PAÍS ofrece de forma gratuita la última hora de la guerra entre Rusia y Ucrania. Si quieres apoyar nuestro periodismo, suscríbete. El presidente ruso, Vladímir Putin, ha abogado por la instauración de un Gobierno ""temporal"" en Ucrania que sustituya al actual que lidera Volodímir Zelenski, auspiciado por la ONU, EE UU, países europeos y países aliados de Rusia cuya misión sería la de organizar unas elecciones de las que saldría un gobierno con el que negociar la paz y, en su caso, firmar un acuerdo de paz. Putin aboga así por deshacerse del actual presidente ucranio, Volodímir Zelenski, al que considera ilegítimo porque no celebró elecciones el año pasado —la ley marcial en Ucrania lo impide―. Washington ha rechazado l a propuesta. El jueves, en París, se debatió la posibilidad de enviar una fuerza militar europea a territorio ucranio cuando se alcance un acuerdo de paz —posibilidad que Ucrania ve con buenos ojos y que Rusia rechaza—. Además, el presidente francés, Emmanuel Macron, anunció que una misión militar francobritánica viajará próximamente a Ucrania para evaluar sobre el terreno las posibilidades de despliegue de una eventual fuerza de paz y para estudiar con responsables ucranios el diseño de las futuras Fuerzas Armadas de ese país. EE UU rechaza la propuesta de Putin de un Gobierno temporal en Ucrania La administración estadounidense ha rechazado este viernes la propuesta del presidente ruso, Vladímir Putin, de instaurar un Gobierno temporal en Ucrania auspiciado por la ONU, EE UU, países europeos y aliados de Rusia cuya misión sería organizar unas elecciones de las que saldría un gabinete con el que negociar la paz. Para Washington, la gobernanza en Ucrania debe ser determinada por su Constitución y por el pueblo ucranio, según ha afirmado un portavoz del Consejo de Seguridad Nacional. Putin propone un Gobierno temporal en Ucrania auspiciado por la ONU y EE UU que celebre elecciones El presidente ruso, Vladímir Putin, abogó este jueves por la noche por la instauración de un Gobierno ""temporal"" en Ucrania que sustituya al actual que lidera Volodímir Zelenski, auspiciado por la ONU, EE UU, países europeos y países aliados de Rusia cuya misión sería la de organizar unas elecciones de las que saldría un gobierno con el que negociar la paz y, en su caso, firmar un acuerdo de paz. El líder ruso ha hecho esta propuesta durante una visita al puerto de Murmask, en el norte de Rusia, a donde ha viajado mientras en París una coalición de voluntarios abogaba por mantener el apoyo a Ucrania y por el envío de una fuerza de paz cuando acabe la guerra y en medio de los intentos patrocinados por EE UU por lograr algún tipo de arreglo. La propuesta rusa insiste en la idea de que el actual Gobierno de Ucrania no es legítimo, pues fue elegido para un mandato de cinco años en 2019 y debería haber celebrado unas nuevas elecciones en mayo de 2024. La ley marcial decretada en Ucrania tras la invasión rusa en febrero..."
Guerra de Rusia y Ucrania — 28 de febrero de 2025,https://elpais.com/internacional/2025-02-28/ultima-hora-de-la-guerra-de-rusia-y-ucrania-en-directo.html,"EL PAÍS ofrece de forma gratuita la última hora de la guerra de Rusia y Ucrania. Si quieres apoyar nuestro periodismo, suscríbete. La Casa Blanca ha emitido este viernes por la noche un comunicado en el que defiende el comportamiento de sus líderes y parece culpar al presidente ucranio, Volodímir Zelenski, de la bronca en la Casa Blanca. El escrito cita la advertencia del presidente estadounidense, Donald Trump, a Zelenski: ""Estás jugando con la tercera guerra mundial"", para indicar que el propio presidente ucranio ha reconocido que la situación podría desencadenar ese tipo de conflicto. Por su parte, la portavoz del ministerio de Exteriores ruso, María Zajárova, ha aprovechado el incidente para cargar contra el presidente ucranio y calificarlo de ""sinvergüenza"". A primera hora de la tarde, Trump ha humillado al presidente ucranio durante un encuentro bronco en el Despacho Oval, en el que ha afirmado que ""debería estar agradecido"". Ambos líderes se habían reunido para firmar el acuerdo por el que Ucrania cedería a EE UU el 50% de los ingresos que obtenga de la explotación de minerales. Sin embargo, la Casa Blanca ha afirmado que el pacto, que se consideraba un primer paso para las negociaciones de paz en Ucrania, no se ha firmado. Los líderes de varios países europeos han salido en defensa de Ucrania, entre ellos, España, Francia, Polonia, Alemania y los altos representantes de la UE. El primer ministro británico, Keir Starmer, ha hablado por teléfono con ambos líderes tras el tenso encuentro y ha confirmado que espera ""recibir a líderes internacionales el domingo, incluido el presidente Zelenski"", según un portavoz de Downing Street. El primer ministro británico ""mantiene su apoyo inquebrantable a Ucrania y está desempeñando su papel para encontrar un camino hacia una paz duradera, basada en la soberanía y la seguridad para Ucrania"", señala el portavoz. Los mensajes de este hilo están ordenados de forma cronológica, del más antiguo al más reciente Buenos días. Arrancamos la narración de la actualidad de la guerra en Ucrania, marcada este viernes por la visita a Washington del presidente ucranio, Volodímir Zelenski, que se dispone a firmar con Donald Trump el acuerdo que da acceso a EE UU a la explotación de minerales en el país. Trump considera que ese acuerdo constituye el pago que hará Ucrania por la ayuda militar recibida de EE UU durante los tres años de guerra, mientras que Kiev exige, a cambio del acuerdo, garantías de seguridad. Anoche, tras reunirse con el primer ministro británico, Keir Starmer, que también reclamó esas garantías para que Rusia no tenga la tentación de nuevas invasiones, afirmó que la mera presencia de intereses estadounidenses en Ucrania ya era garantía suficiente de que no sería atacada de nuevo. Trump: ""Rusia se está comportando muy bien. Avanzamos en un acuerdo de paz"" El primer ministro británico, Keir Starmer, llegó a su reunión de este jueves con Donald Trump en la Casa Blanca con una misión por encima de todas las demás: tratar de arrancar a su interlocutor..."
Guerra de Ucrania y Rusia - 26 de marzo de 2025,https://elpais.com/internacional/2025-03-26/ultima-hora-de-la-guerra-de-rusia-y-ucrania-en-directo.html,"EL PAÍS ofrece de forma gratuita la última hora de la guerra entre Rusia y Ucrania. Si quieres apoyar nuestro periodismo, suscríbete. El presidente francés, Emmanuel Macron, ha anunciado que enviará a Kiev 2.000 millones de euros en equipamiento militar. Lo ha comunicado a la salida de su reunión en el Elíseo con su homólogo ucranio, Volodímir Zelenski, para preparar la cumbre de apoyo a Ucrania que se celebrará mañana jueves en París. A la salida de la cita, Macron ha ratificado la postura de la portavoz de la UE para Asuntos Exteriores, Anitta Hipper, quien esta mañana ha asegurado que la retirada de las fuerzas rusas de Ucrania es uno de los requisitos para levantar o modificar las sanciones contra Rusia. Esta afirmación responde a la exigencia de Rusia de que se cumplan ""una serie de condiciones"" (como el alivio de las sanciones) para adherirse al acuerdo alcanzado ayer por Kiev y Moscú con la mediación de Washington para detener los ataques en el mar Negro y contra las infraestructuras energéticas. Zelenski se ha referido a los bombardeos rusos de anoche contra varias ciudades ucranias y ha afirmado qu una clara señal de que Moscú no busca una paz real"". Los mensajes de este hilo están ordenados de forma cronológica, del más antiguo al más reciente Buenos días. Arrancamos la narración de la actualidad del conflicto en Ucrania, el día después de que Rusia y Ucrania aceptasen comprometerse a un alto el fuego en el mar Negro y sobre sus instalaciones de energía. La duda es cuándo podrá entrar en vigor la primera parte, por cuanto Moscú exige que se eliminen algunas de las sanciones internacionales impuestas en estos tres años de guerra, de modo que pueda exportar sus productos agrícolas, especialmente sus fertilizantes. De hecho, Rusia ha atacado durante la noche el puerto de Mikolaiv, un puerto fluvial con acceso al mar Negro. En el plano diplomático, el presidente de Ucrania, Volodímir Zelenski, viajará este miércoles a París, donde participará el jueves en la reunión de líderes europeos que apoyan a Ucrania y reclaman la presencia de Europa en las negociaciones para poner fin al conflicto. La llamada coalición de voluntarios busca un compromiso ""explícito"" y ""detallado"" del apoyo militar que están dispuestos a dar en el corto plazo a Ucrania frente a Rusia. Rusia ataca un puerto de Ucrania pese al acuerdo de tregua sobre el mar Negro Rusia ha atacado con drones durante la noche el puerto de Mikolaiv, en la desembocadura del río Bug y con acceso al mar Negro. El ataque se ha producido apenas unas horas después de que Rusia y Ucrania acordasen, sin poner fecha, dejar de atacar tanto sus infraestructuras energéticas como objetivos en el mar Negro, lo que debería incluir instalaciones porturarias. También ha atacado la ciudad de Krivi Rih, la ciudad natal del presidente ucranio, Volodímir Zelenski. El alcalde de Mikolaiv ha informado de que se van a producir cortes de electricidad tras el ataque. El gobernador de la..."
Guerra de Rusia y Ucrania — 5 de marzo de 2025,https://elpais.com/internacional/2025-03-05/ultima-hora-de-la-guerra-de-rusia-y-ucrania-en-directo.html,"EL PAÍS ofrece de forma gratuita la última hora de la guerra de Rusia y Ucrania. Si quieres apoyar nuestro periodismo, suscríbete. El asesor de Seguridad Nacional de la Casa Blanca, Mike Waltz, ha asegurado este miércoles que el presidente de Estados Unidos, Donald Trump, restaurará la ayuda militar a Ucrania si se organizan ""conversaciones de paz"" y se toman ""medidas de confianza"". En una entrevista con la cadena estadounidense Fox News Waltz ha explicado que deben comprobar que ambas partes están negociando ""sinceramente"". Asegura que su Gobierno trabaja ya en la construcción de esas ""medidas de confianza"", que no ha especificado. En otra entrevista con la misma cadena, el director de la CIA, John Ratcliffe, ha confirmado que, además de la ayuda militar, EE UU ha congelado el suministro de datos de inteligencia a Ucrania, una información crucial para permitir a Kiev resistir la invasión rusa. ""En el frente militar y en el frente de la inteligencia la pausa que permitió que eso pasara [que el presidente de Ucrania, Volodímir Zelenski, emitiera un comunicado en el que aseguraba que trabajaría bajo el liderazgo de Trump para alcanzar la paz] creo que desaparecerá y volveremos a trabajar codo con codo con Ucrania"", ha dicho Ratcliffe. Horas después, el presidente ucranio, Volodímir Zelenski, ha manifestado que ha habido un ""movimiento positivo"" en la relación con Estados Unidos que podría conducir a otra reunión entre las dos partes pronto. ""Hoy, los equipos ucranio y estadounidense han comenzado a trabajar en la próxima reunión. Andri Yermak y Mike Waltz han hablado y hay un movimiento positivo. Esperamos ver algunos resultados la próxima semana"", ha manifestado en un mensaje publicado en sus redes sociales. Los mensajes de este hilo están ordenados de forma cronológica, del más antiguo al más reciente Buenos días. Arrancamos la narración en directo de la última hora del conflicto en Ucrania en este miércoles 5 de marzo, un día después de que el presidente ucranio, Volodímir Zelenski, propusiera a Rusia ""una tregua en el cielo"", es decir, frenar los ataques aéreos mutuos de largo alcance contra infraestructuras civiles y, sobre todo, contra sus respectivas industrias energéticas. Trump asegura que ha recibido una carta de Zelenski en la que dice que está dispuesto a negociar y a firmar el acuerdo sobre minerales El presidente de EE UU, Donald Trump, aseguró en el discurso ante el Congreso de este martes haber recibido como carta de Volodímir Zelenski el mensaje que había tuiteado horas antes el presidente ucranio, en que mostraba su disposición a negociar. ""Estoy trabajando incansablemente para poner fin al salvaje conflicto en Ucrania. Millones de ucranios y rusos han sido asesinados o heridos innecesariamente en este horrible y brutal conflicto, sin que se vislumbre un final"", dijo Trump, usando de nuevo cifras falsas sobre la ayuda prestada por Estados Unidos y Europa, aunque acaso consciente de que mentía puso un ""quizás"" antes de la cifra de 350.000 millones de dólares supuestamente aportados. Después de eso, anunció que había recibido una..."
Trump rompe el tabú de la negociación por los territorios de Ucrania,https://elpais.com/internacional/2025-03-18/trump-rompe-el-tabu-de-la-negociacion-por-los-territorios-de-ucrania.html,"Hubo un momento de especial tensión en la reunión de Yeda (Arabia Saudí) del 11 de marzo entre las delegaciones de Estados Unidos y Ucrania. Fue cuando Mike Waltz, consejero de Seguridad Nacional de la Casa Blanca, puso sobre la mesa un mapa de Ucrania para dibujar sobre el mismo qué reparto de territorios podría negociarse con Rusia para finalizar la guerra. El equipo ucranio, encabezado por Andri Yermak, mano derecha del presidente Volodímir Zelenski, pidió que este asunto se dejara para má... s adelante, pero sus interlocutores replicaron que debía ser ya. Así lo han revelado varios medios ucranios que han hablado con testigos del encuentro, sin que haya trascendido por dónde pasó el bolígrafo de Waltz. Donald Trump y sus hombres de confianza han subrayado cada día desde entonces que Ucrania debe asumir que tendrá que hacer concesiones territoriales. El presidente de EE UU ha roto un tabú, quizá el mayor en Ucrania, y es el de los sacrificios territoriales. Hasta que no llegó Trump al poder, fuera su predecesor Joe Biden o los aliados europeos de Kiev, la posición oficial y unánime en Occidente era que sería Ucrania la que decidiría cuándo debían iniciarse las negociaciones de paz y en qué condiciones. Pero ni la cúpula política ni militar ucrania ha mencionado todavía públicamente algo que ahora parece inevitable: que Vladímir Putin no retornará todo lo ocupado en el país invadido y que EE UU tampoco se lo exigirá. ""Cualquier acuerdo pasará por las cesiones territoriales de Ucrania y los compromisos de seguridad de Rusia"", ha dicho Waltz. Trump tiene previsto entrevistarse telefónicamente este martes con Putin para hablar de su propuesta de alto el fuego de 30 días, y el principal escollo a tratar, según ha confirmado el presidente estadounidense, es ""el reparto de activos"" entre Rusia y Ucrania. Trump reiteró que ya ha abordado antes esta cuestión, tanto con el Kremlin como con Bánkova, como se conoce a la sede de la presidencia ucrania. Zelenski ha afirmado que él y su equipo participarán en las negociaciones de paz ""bajo el fuerte liderazgo del presidente Trump"". La iniciativa de la tregua es de la Casa Blanca, según señala la oficina de Zelenski, y deben ser los estadounidenses los que dirijan las conversaciones con Rusia. El enviado especial de Trump para Rusia, Steve Witkoff, se entrevistó el viernes con Putin en Moscú. Witkoff explicó en la CNN que la reunión había sido ""positiva"", que había permitido limar diferencias entre Rusia y EE UU y que las concesiones territoriales habían sido discutidas. La pérdida de control de sus regiones es en Ucrania el elefante en la habitación, como dice la expresión en inglés, una obviedad que se pretende ignorar. La posición oficial de Zelenski es que su país nunca reconocerá la soberanía de Rusia en los territorios ocupados. En este sentido se manifestó este lunes en RBC su ministro de Exteriores, Andrii Sibiga: ""Hay cosas fundamentales que no son negociables, que no pueden tocarse. La primera, la integridad..."
Guerra de Rusia y Ucrania — 13 de marzo,https://elpais.com/internacional/2025-03-13/ultima-hora-de-la-guerra-de-rusia-y-ucrania-en-directo.html,"EL PAÍS ofrece de forma gratuita la última hora de la guerra de Rusia y Ucrania. Si quieres apoyar nuestro periodismo, suscríbete.... Ucrania ha acordado con Estados Unidos que los representantes de Europa participen finalmente en el proceso de paz, según ha contado el jefe de gabinete del presidente ucranio, Andrii Yermak. Hasta ahora, las partes rusa y estadounidense han mostrado reticencias a incluir a los aliados europeos en las negociaciones para un alto el fuego. Por su parte, el presidente estadounidense, Donald Trump, ha revelado que Washington ya ha abordado con Ucrania qué territorios perdería en un presumible acuerdo de paz. Trump ha afirmado además que su enviado especial, Steve Witkoff, ha comenzado ya las conversaciones previstas para este jueves en Moscú sobre la posible tregua. ""Espero que hagan lo correcto"", ha declarado sobre las autoridades rusas. En paralelo, el mandatario ruso Vladímir Putin ha comentado por primera vez la propuesta de una tregua y ha asegurado que su país ""está de acuerdo con las propuestas para poner fin a las hostilidades, pero asume que deben conducir a una paz a largo plazo y a la eliminación de las causas principales del conflicto"". Los mensajes de este hilo están ordenados de forma cronológica, del más antiguo al más reciente Buenos días, arrancamos la narración en directo de la última hora del conflicto en Ucrania, en este jueves 13 de marzo. Seguimos pendientes de la respuesta de Moscú a la propuesta de tregua parcial acordada entre Kiev y EE UU en la reunión del martes en Arabia Saudí y de la situación de las tropas ucranias en la región rusa de Kursk, donde las fuerzas del Kremlin siguen avanzando. Este jueves, los países del G-7 celebran una cumbre en Canadá, en la que también abordarán la cuestión del conflicto. El presidente ruso, Vladímir Putin, por su parte, se reunirá con su homólogo bielorruso, Aleksandr Lukashenko. El plan de tregua en Ucrania coloca a Putin ante el dilema de enfadar a Trump o a los nacionalistas rusos Nadie en Rusia se esperaba hace dos meses que Donald Trump anunciase tantas concesiones al Kremlin y humillase en directo al ucranio Volodímir Zelenski. Pero el idilio perfecto entre el presidente estadounidense y Vladímir Putin se ha desvanecido de pronto con la propuesta de Washington de una tregua de 30 días acompañada de una Kiev rearmada. Muchos rusos vuelven ahora a convencerse de que los denostados Estados Unidos siguen siendo el enemigo de siempre. El Kremlin se tomará un tiempo para responder. Pero será difícil contentar al mismo tiempo a Trump, al que urge quitarse la cuestión ucrania de encima, y a cientos de miles de rusos que han sacrificado sus vidas por la cruzada de Putin en Ucrania. Puedes leer aquí la información completa Rusia asegura que la operación para recuperar la región de Kursk de manos ucranias está ""en su fase final"" Rusia está a punto de completar la recuperación del territorio de la provincia de Kursk que las tropas ucranias ocuparon..."
