title,url,text
Algo pasa con Telegram,https://elpais.com/opinion/2024-08-26/algo-pasa-con-telegram.html,"El multimillonario ruso Pável Dúrov ha sido arrestado en el aeropuerto de París cuando llegaba de Azerbaiyán, donde también estaba Vladímir Putin. La Oficina de Menores de la dirección nacional de la policía judicial francesa lo acusa de permitir delitos de fraude, tráfico de drogas, ciberacoso y crimen organizado en Telegram. El servicio de mensajería que lanzó en 2013 se acerca ya a los mil millones de usuarios y es famoso por su defensa del anonimato y la libertad de expresión.
Hay quien piensa que el arresto tiene que ver con Putin y con la guerra de Ucrania. ""El arresto podría tener motivos políticos y ser un medio para obtener los datos personales de los usuarios de Telegram. No debemos permitirlo"", ha tuiteado Vladislav Davankov, vicepresidente de la Duma estatal. La embajada ha reclamado acceso consular para aclarar la situación, pero Dúrov tiene pasaporte francés. No está sujeto a intercambio o extradición.
Otros piensan que ha sido arrestado por ser otro absolutista de la libre expresión. ""Es 2030 en Europa y estás siendo ejecutado por dar 'me gusta' a un meme,"" ha tuiteado Elon Musk. Telegram no modera contenidos ni pone límites a la desinformación. Hay activistas y traficantes, feministas y neonazis, periodistas, abogados y extorsionadores. Asaltantes al capitolio, influencers racistas, iraníes adolescentes que sólo quieren estudiar. Es el servicio de comunicación más popular en Bielorrusia, Kazajistán y Camboya. Pero, ¿garantiza realmente su seguridad?
Signal, otra plataforma de mensajes, cifra todas las comunicaciones de extremo a extremo y no guarda mensajes ni claves ni datos personales en sus servidores. Si no tiene los datos, no puede entregarlos a las autoridades aunque lo pida un juez. También somete su código a auditorías para demostrar que funciona como dice. Telegram no cifra de extremo a extremo por defecto, guarda datos del usuario y del dispositivo como nombre, teléfono, contactos o dirección IP, y guarda metadatos y conversaciones en la nube. Y usa un protocolo propietario (no transparente) llamado MTProto. Es un problema que la única garantía de los usuarios sea la palabra de un multimillonario que vive en los Emiratos, porque muchos creen que trabaja para el Kremlin desde al menos 2020."
Trump endurece la guerra comercial con aranceles del 25% a los coches no fabricados en Estados Unidos,https://elpais.com/internacional/2025-03-26/trump-anunciara-este-miercoles-aranceles-a-la-importacion-coches.html,"La guerra comercial se recrudece. El presidente de Estados Unidos, Donald Trump, anunció este miércoles aranceles del 25% a todos los coches y vehículos ligeros importados que entrarán en vigor el 3 de abril. El anuncio de Trump ha ido algo más allá de la literalidad de la norma. ""Lo que vamos a hacer es aplicar un arancel del 25% a todos los coches que no se fabriquen en Estados Unidos"", dijo Trump en el Despacho Oval de la Casa Blanca, calificando la medida de ""muy modesta"". La Casa Blanca ha matizado posteriormente el anuncio de Trump. Los importadores de automóviles en virtud del Tratado entre México, Estados Unidos y Canadá (TMEC) tendrán la oportunidad de certificar su contenido estadounidense y se implementarán sistemas para que el arancel del 25% solo se aplique al valor de su contenido no estadounidense. Las piezas de automóvil que cumplan con el TMEC permanecerán libres de aranceles hasta que el secretario de Comercio, en consulta con la Oficina de Aduanas (CBP), establezca un proceso para aplicar aranceles a su contenido no estadounidense. El arancel del 25% se aplicará a los vehículos de pasajeros importados (sedanes, SUV, crossovers, minivans, furgonetas de carga) y camiones ligeros, así como a las piezas clave de automóviles (motores, transmisiones, piezas del tren motriz y componentes eléctricos). Cabe ampliar los aranceles a piezas adicionales si es necesario, según la Casa Blanca. Poco después de este anuncio sobre los vehículos importados, el presidente amenazó de forma específica con imponer aranceles ""a gran escala"" a la Unión Europea y Canadá en un mensaje en su red social Truth: ""Si la Unión Europea colabora con Canadá para perjudicar económicamente a EE UU., se les impondrán aranceles a gran escala, mucho mayores de lo previsto, para proteger al mejor amigo que ambos países han tenido"". Las Bolsas estadounidenses cayeron con fuerza durante la sesión al conocerse las intenciones de Trump. La caótica política económica y comercial del presidente está aumentando la incertidumbre y haciendo perder fuelle a la economía estadounidense y, con ello, a la de todo el mundo. La confianza de los consumidores se ha desplomado hasta niveles de la pandemia, según los datos publicados este martes por The Conference Board. Los mercados llevan semanas sufriendo. Las agencias de calificación también ven con preocupación las medidas erráticas y contradictorias de Trump. En solo unas semanas, el presidente está malbaratando la herencia recibida de Joe Biden. Los aranceles harán subir los precios de los coches importados, haciéndolos menos competitivos frente a los estadounidenses, cuyos costes a su vez se han encarecido por los aranceles al aluminio y al acero, entre otros. Los ciudadanos tendrán que pagar más, en definitiva. En la actualidad, en torno a la mitad de los coches que se venden en Estados Unidos son importados. Trump espera que sus impuestos a la importación obliguen a las empresas a trasladar más producción a Estados Unidos y atraigan inversión, pero la inseguridad jurídica generada por un Gobierno que toma sus decisiones de forma..."
Los aranceles de Trump a los coches asestan un golpe a una industria europea ya con problemas y se ceban con Alemania,https://elpais.com/internacional/2025-03-28/los-aranceles-de-trump-a-los-coches-asestan-un-golpe-a-una-industria-europea-ya-con-problemas-y-se-ceban-con-alemania.html,"Enfrascada como está la Unión Europea en reverdecer su esplendor industrial para ganar competitividad, este miércoles recibió un golpe de doble impacto desde Estados Unidos en el corazón mismo del sector manufacturero: los fabricantes de automóviles. La subida de aranceles al 25% para las exportaciones de coches se esperaban, pero no por eso dejan de añadir pesimismo a las perspectivas ya lúgubres de una industria muy presionada por la pujanza de los coches eléctricos chinos. Y, sin embargo, su presente todavía muestra bastante vigor, basado, en parte, en la intensa relación comercial transatlántica y el prestigio del coche made in Germany: el primer mercado de los turismos de la UE es Estados Unidos, donde van vehículos por casi 40.000 millones de euros de los que más de la mitad se han ensamblado en Alemania. ""Ahora es importante que la UE dé una respuesta firme a los aranceles. Debe quedar claro que no vamos a ceder ante Estados Unidos"", declaró el ministro de Economía alemán, Robert Habeck, después de darse a conocer la noticia. ""Se necesita fuerza y confianza en uno mismo"", apuntó el político de Los Verdes, que habló de una mala noticia ""para los fabricantes de automóviles alemanes, para la economía alemana, para la UE, pero también para EE UU"". Tanto Berlín como Bruselas apuestan por una salida dialogada a la guerra comercial con EE UU, que, por ahora, deja un parte con aranceles estadounidenses ya en vigor del 25% al acero y al aluminio y el consiguiente anuncio de una respuesta europea por 26.000 millones de euros. La presidenta de la Comisión Europea, Ursula von der Leyen, reiteró la noche del miércoles que ""buscará una solución negociada"". Pero los resultados logrados hasta ahora en las reuniones son magros. A comienzos de esta semana, el comisario de Comercio, Maros Sefcovic, y el propio jefe de gabinete de Von der Leyen, Björn Seibert, viajaron a Washington para reunirse con el secretario de Comercio, Howard Lutnick, el martes. La reunión no evitó que al día siguiente el presidente Donald Trump castigara a los coches de importación europeos, al igual que a los del resto del mundo. Una impotencia que en Bruselas ha causado frustración. ""Sefcovic acaba de viajar a EE UU. Lamentablemente, sin éxito. [...] Aparentemente, es necesaria una escalada antes de que EE UU esté dispuesto a hablar sobre condiciones comerciales justas"", ha declarado este jueves Bernd Lange, presidente de la Comisión de Comercio en el Parlamento Europeo. Esa escalada se verá, probablemente, la semana que viene, cuando entrarán en vigor los nuevos aranceles. Este jueves Bruselas se ha limitado a señalar que la respuesta será ""firme, proporcionada, robusta, bien calibrada y oportuna"". Fuentes de la Comisión explican que el anuncio de la retorsión llegará en torno al 3 de abril, día en que empezarán a aplicarse los nuevos derechos aduaneros. Ese anuncio llegará un par de semanas antes de la decisión definitiva sobre la primera respuesta de la UE al incremento de tarifas aduaneras sobre el acero y el..."
Los fabricantes de coches se desploman en Bolsa por los aranceles de Trump,https://elpais.com/economia/2025-03-27/los-fabricantes-de-coches-se-desploman-en-bolsa-por-los-aranceles-de-trump.html,"Las acciones de las principales empresas fabricantes de automóviles caen con fuerza en Bolsa tras la decisión del presidente de Estados Unidos, Donald Trump, de imponer aranceles del 25% a los vehículos ligeros importados y sus componentes. La medida supone una disrupción en la cadena de suministros de las grandes empresas del motor estadounidenses. También es un golpe para otros fabricantes internacionales para los que Estados Unidos es un mercado relevante. Las cotizaciones de empresas como General Motors, Ford y Stellantis ya habían caído con fuerza durante el horario regular de la sesión, pero sus pérdidas se han acentuado después de conocerse los detalles de la decisión de Trump. También otras multinacionales del motor cotizadas en Estados Unidos, como Toyota, han caído con fuerza. Tras haber caído más de un 3% durante la sesión, las acciones de General Motors retroceden cerca de otro 7% fuera del horario habitual. Ford resistió durante la sesión, pero caía cerca de un 5% en las operaciones posteriores. Stellantis cede un 7% en el conjunto de la jornada. Incluso Tesla, en principio beneficiada, ha caído un 5,58% en la sesión y ampliaba las pérdidas tras el cierre. Las acciones de las japonesas Toyota, Honda, Nissan y Mazda también caían en Tokio este jueves, con descensos cercanos al 2%. Las coreanas Hyundai y Kia han cotizado a la baja este jueves, con descensos superiores al 3%. Las compañías europeas también se han visto golpeadas en Bolsa por los aranceles estadounidenses desde antes de que se conocieran con detalle. El sector del automóvil es el más penalizado del índice Stoxx 600 este jueves, con una caída que empezó siendo mayor pero que se ha moderado al 2%. Entre los valores más castigados destaca el fabricante de componentes Valeo, que cede cerca del 4,5%, seguido de Stellantis y Porsche, que encajan recortes del 4%. Mercedes Benz y BMW pierden alrededor de un 3% y Volkswagen, el 2%. Decenas de miles de millones de dólares de valor de mercado de las empresas del sector se han volatilizado en un solo día con el anuncio de Trump, cuya guerra comercial amenaza con dañar la economía no solo de Estados Unidos, sino de todo el mundo. La confianza de los consumidores estadounidenses se ha hundido, según una encuesta publicada este martes por The Conference Board, la principal referencia en la materia. La Reserva Federal ha rebajado sus previsiones de crecimiento y elevado las de inflación. El arancel del 25% se aplicará a los vehículos de pasajeros importados (sedanes, SUV, crossovers, minivans, furgonetas de carga) y camiones ligeros, así como a las piezas clave de automóviles (motores, transmisiones, piezas del tren motriz y componentes eléctricos). Cabe ampliar los aranceles a piezas adicionales si es necesario, según la Casa Blanca. Los importadores de automóviles en virtud del Tratado entre México, Estados Unidos y Canadá (TMEC) tendrán la oportunidad de certificar su contenido estadounidense y se implementarán sistemas para que el arancel del 25% solo se aplique al valor de su contenido no estadounidense...."
El primer ministro de Canadá dice que la relación histórica con Estados Unidos “ha terminado”,https://elpais.com/internacional/2025-03-27/el-primer-ministro-de-canada-dice-que-la-antigua-relacion-con-estados-unidos-ha-terminado.html,"Los aranceles del 25% a la importación de automóviles anunciados por Donald Trump han caído como una bomba en la vecina Canadá, inmersa en plena campaña electoral para las elecciones del próximo 28 de abril. El primer ministro, Mark Carney, los considera un ""ataque directo"" que hará sufrir al país, según dijo el miércoles. Este jueves, Carney ha dado un discurso solemne que marca un cambio de era en la relación entre dos países vecinos que han sido amigos y aliados durante generaciones. ""La antigua relación que teníamos con Estados Unidos, basada en la integración cada vez mayor de nuestras economías y en una estrecha cooperación en materia de seguridad y militar, ha terminado"", ha dicho Carney. El primer ministro canadiense promete responder con ""acciones comerciales de represalia que tendrán el máximo impacto en Estados Unidos y el mínimo impacto en Canadá"", según ha anunciado, pero sin detallar cuáles son esas medidas. Carney prevé dedicar todo lo que se recaude con los aranceles de represalia a ayudar a los trabajadores afectados por los aranceles de Trump. ""El presidente Trump volvió a imponer aranceles injustificados a nuestro país, violando nuestros acuerdos comerciales vigentes. Esta vez, apuntó a la industria automotriz y a los más de 500.000 canadienses trabajadores y dedicados que esa industria apoya en todo nuestro país"", inició Carney su intervención. ""Entiendo y respeto su objetivo de apoyar a los trabajadores estadounidenses, pero no estoy de acuerdo con él en que esta sea la forma de ayudar. Con el tiempo, se hará evidente que estas acciones terminarán perjudicando a los trabajadores y consumidores estadounidenses. Rechazo cualquier intento de debilitar a Canadá, de desgastarnos, de quebrarnos para que Estados Unidos pueda adueñarse de nosotros. Eso nunca sucederá, y nuestra respuesta a estos últimos aranceles es luchar, es proteger y construir"", ha añadido Carney. El primer ministro canadiense ha informado de que Trump se puso en contacto con él para programar una llamada entre ambos, que se producirá en uno o dos días, según ha dicho. La primera visita internacional de los mandatarios canadienses suele ser a Estados Unidos. Carney, sin embargo, ni siquiera ha hablado por teléfono con Trump desde que asumió el cargo el pasado 14 de marzo. En lugar de ello, prefirió viajar al Reino Unido y Francia y reforzar sus lazos de amistad. La llamada, según ha anticipado, se producirá en un día o dos. ""Agradezco esta oportunidad para discutir cómo podemos proteger a nuestros trabajadores y construir nuestras economías. Le dejaré claro al presidente que esos intereses se sirven mejor con la cooperación y el respeto mutuo, incluyendo nuestra soberanía"", ha dicho Carney. El de Carney ha sido un discurso algo dramático. ""Para mis conciudadanos canadienses, no quiero crear expectativas poco razonables. El camino por delante será largo. No hay una bala de plata, no hay una solución rápida, y sé y entiendo que muchos se sienten ansiosos y preocupados por el futuro"", ha dicho, tratando de lanzar también mensajes de optimismo: ""Somos más fuertes cuando estamos..."
El déficit comercial de Estados Unidos se disparó un 60% en febrero por los aranceles de Trump,https://elpais.com/economia/2025-03-27/el-deficit-comercial-de-estados-unidos-se-disparo-un-60-en-febrero-por-los-aranceles-de-trump.html,"Los aranceles de Donald Trump están teniendo por ahora el efecto contrario al deseado por el mandatario. Las amenazas del presidente de Estados Unidos de imponer altos impuestos a las importaciones de mercancías de todo tipo han provocado una aceleración de las compras. El déficit comercial ya pulverizó récords en enero y en febrero sigue disparado, según los datos provisionales publicados este jueves por la Oficina del Censo de Estados Unidos. Ese desfase contribuye también a lastrar a la economía estadounidense, a la que no le están sentando nada bien las políticas de Trump. El déficit comercial internacional fue de 147.914 millones de dólares en febrero, según los datos con ajuste estacional. Aunque supone una ligera reducción frente a la cifra sin precedentes de enero, es la segunda cifra más alta de la serie histórica y aumenta un 60% frente a los 92.309 millones del mismo mes del año anterior. Las exportaciones de bienes fueron de 178.599 millones de dólares, 4.312 millones de dólares más que hace un año, pero lo que se dispararon fueron las importaciones, que sumaron 326.513 millones de dólares, frente a los 266.596 millones de enero de 2024. El tirón de las importaciones y del déficit se concentra en los suministros industriales (donde se incluye el petróleo), bienes de capital y de consumo. Los datos avanzados por el censo no desglosan la evolución de las importaciones, las exportaciones y el déficit por países, datos que se publicarán más adelante. Los aranceles decretados por el presidente apenas habían entrado en vigor en marzo. Dentro de su errática política comercial, Trump aplazó los gravámenes a los productos mexicanos y canadienses poco antes de que entrasen en vigor, después de haberlos aprobado. En cambio, en el caso de China sí entró en vigor un impuesto del 10% a todas las importaciones antes de que el presidente rectificase y dejase exentos a la mayoría de los envíos, los de menos de 800 dólares, tras provocar el colapso aduanero con su improvisación y falta de preparativos. Trump ha seguido dando pasos adelante y atrás en la guerra comercial que ha declarado a todo el mundo. En marzo entraron en vigor los aranceles del 25% al acero y el aluminio, se aplicó otro 10% adicional a las importaciones chinas (excluidas las de pequeño volumen) y entraron en vigor fugazmente los aranceles a México y Canadá, antes de otra rectificación que dejó exentos hasta el 2 de abril a los productos acogidos al Tratado entré México, Estados Unidos y Canadá (TMEC). Esta misma semana, Trump ha autorizado imponer aranceles del 25% a los productos procedentes de todos los países que compren petróleo a Venezuela y, además, ha aprobado aranceles del 25% a la importación de automóviles y componentes a aplicar desde el 3 de abril con unas mínimas excepciones. El arancel del 25% se aplicará a los vehículos de pasajeros importados (sedanes, SUV, crossovers, minivans, furgonetas de carga) y camiones ligeros, así como a las piezas clave de automóviles (motores, transmisiones, piezas del..."
La UE promete una respuesta “firme y proporcionada” a los nuevos aranceles de Trump,https://elpais.com/internacional/2025-03-27/la-ue-promete-una-respuesta-firme-y-proporcionada-a-los-nuevos-aranceles-de-trump.html,"La Comisión Europea ha reiterado este jueves su rechazo a la nueva tanda de aranceles, esta vez sobre los coches, anunciada el miércoles por el presidente de Estados Unidos, Donald Trump. El Ejecutivo comunitario ha asegurado estar listo para dar una respuesta ""firme, robusta y calibrada"" a la medida estadounidense, sin fijar, sin embargo, una fecha para ello.
""Estamos preparados para salvaguardar nuestros intereses económicos y, en caso necesario, daremos una respuesta firme, proporcionada, robusta, bien calibrada y oportuna a cualquier medida injusta y contraproducente de Estados Unidos"", ha advertido el portavoz comunitario para Comercio.
Bruselas ha recibido sin sorpresa, pero con inquietud y enfado, el nuevo anuncio de Trump, quien en la noche del miércoles anunció aranceles del 25% a todos los coches y vehículos ligeros importados, a partir del 3 de abril. Esa semana, además, Washington podría anunciar nuevos aranceles, amenazó Trump. Europa está haciendo ya preparativos para responder a estas medidas, aunque también ha asegurado que se tomará su tiempo para responder, en vista de las imprecisiones que rondan hasta ahora todas las ofensivas comerciales estadounidenses, señalan fuentes comunitarias.
Nada más conocer el anuncio de Washington sobre los automóviles, la presidenta de la Comisión Europea, Ursula von der Leyen, emitió un breve comunicado en el que lamentaba ""profundamente"" una decisión negativa ""para las empresas y consumidores, tanto en la UE como en Estados Unidos"". Esta es una advertencia que Bruselas lleva haciendo desde las primeras amenazas arancelarias de Trump. Pero, hasta ahora, parece haber caído en saco roto, en vista de los nuevos anuncios y de la entrada en vigor de una primera tanda de represalias, contra el aluminio y el acero, que Europa ha prometido responder con aranceles a productos estadounidenses por valor de hasta 26.000 millones de euros.
Bruselas todavía está estudiando la última amenaza arancelaria, pero asegura, una vez más, que no le temblará la mano en su respuesta, por mucho que duela a todas las partes. Eso sí, ha puntualizado el portavoz comunitario, se responderá de forma ""estratégica"".
""Nuestra respuesta tiene que ser muy estratégica. Nosotros no queremos tener que responder, pero, aun a riesgo de sonar como mi hijo de tres años, no somos nosotros los que empezamos esto"", ha recordado.
Mientras prepara su respuesta, Bruselas intenta, a la par, mantener la puerta abierta a una solución negociada. A pesar de que el principal responsable de la Comisión en la materia, el comisario de Comercio, Maros Sefcovic, acabe de realizar esta misma semana un viaje a Washington del que ha regresado con las manos vacías.
""Nuestra prioridad es encontrar una solución negociada que funcione para las dos partes, para la UE y EE UU; una solución que refuerce nuestra relación económica, que es de lejos la más valiosa e importante del mundo"", ha dicho al respecto el portavoz comunitario. ""Queremos incrementar esa relación, no derribarla, y consideramos que las nuevas medidas estadounidenses van totalmente en la dirección contraria"", ha lamentado."
Minianálisis de cómo los aranceles de Trump impactan en la industria automotriz europea,https://elpais.com/expres/2025-03-28/minianalisis-de-como-los-aranceles-de-trump-impactan-en-la-industria-automotriz-europea.html,"El nuevo anuncio del presidente de Estados Unidos, Donald Trump, de imponer aranceles del 25% a los vehículos no fabricados en Estados Unidos marca un nuevo capítulo en la guerra comercial que ha tensionado, desde su llegada al poder, las relaciones económicas internacionales.
¿Por qué es importante? Esta medida, que entra en vigor el 3 de abril, amenaza con golpear duramente a la industria automotriz europea (ya presionada por la pujanza de los coches eléctricos chinos) y pone a Alemania, principal exportador europeo de vehículos hacia EE UU, en el ojo del huracán.
Alemania, el epicentro del golpe:
La represalia de la UE: el Ejecutivo comunitario ha asegurado estar listo para dar una respuesta ""firme, robusta y calibrada"" a la medida estadounidense, sin fijar una fecha para ello.
©Foto: Jens Schlueter (Getty Images)
Si quieres saber más, puedes leer aquí."
