title,url,text
La Casa Blanca retira la nominación de Elise Stefanik como embajadora ante la ONU para no perder un escaño en la Cámara de Representantes,https://elpais.com/internacional/2025-03-27/la-casa-blanca-retira-la-nominacion-de-elise-stefanik-como-embajadora-ante-la-onu-para-no-perder-un-escano-en-la-camara-de-representantes.html,"La Casa Blanca ha informado al presidente del Comité de Relaciones Exteriores del Senado que retirará la nominación de la congresista Elise Stefanik como embajadora de Estados Unidos ante las Naciones Unidas, lo que refleja la importancia que reviste el voto de esta representante por Nueva York para avanzar en la Cámara baja la agenda del presidente Trump, dada la exigua minoría de que gozan los republicanos. Stefanik era de los últimos nombramientos del mandatario pendientes de confirmar por el Senado, por lo que no estuvo presente en importantes votaciones tanto en el Consejo de Seguridad como en la Asamblea General de la ONU. El presidente del Comité de Relaciones Exteriores del Senado, el republicano James E. Risch, recibió una notificación de la Casa Blanca el jueves por la tarde de que retiraba la nominación de Stefanik, fiel aliada de Trump, confirmando un rumor que llevaba horas circulando por los cenáculos de Washington. ""Recibí una llamada de la Casa Blanca"", dijo Risch, en el transcurso de la cual le dijeron que ""iban a retirar la nominación"". Los republicanos de la Cámara de Representantes habían manifestado su preocupación ante el hecho de que una confirmación de Stefanik como embajadora en la ONU les haría aún más difícil avanzar la agenda de gobierno de Trump en la Cámara baja. La baja de Stefanik en la Cámara de Representantes implicaba la convocatoria especial de unas elecciones por parte de la gobernadora de Nueva York, la demócrata Kathy Hochul, para sustituirla en su escaño. De hecho, la nominación de Stefanik, defensora a ultranza de Israel, había languidecido sin que la ONU tuviera noticia de una fecha aproximada de incorporación. Su función en las decisivas votaciones del Consejo de Seguridad y la Asamblea General sobre la guerra de Ucrania o la de Gaza ha sido desempeñado por la encargada de negocios de la misión, que viene a ser la número tres del escalafón diplomático. Stefanik, que en diciembre de 2023 llevó la voz cantante en la audiencia del Congreso a tres rectoras acusadas de no responder con firmeza a manifestaciones antisemitas en sus campus —las tres acabaron renunciando—, ha arremetido también contra la ONU, a la que acusa del pecado más nefando para la Administración a la que pertenece: las críticas a Israel, tildadas por Washington de antisemitismo. El estrecho margen de los republicanos en la Cámara de Representantes complicaba sobremanera algunas de las principales iniciativas del programa de gobierno del presidente Trump. Actualmente, los republicanos ocupan 218 escaños frente a los 213 de los demócratas y hay cuatro vacantes. Con esos números, los republicanos sólo pueden permitirse el lujo de sufrir dos deserciones y aun así aprobar un proyecto de ley en una votación basada en la línea del partido, es decir, en la disciplina de voto. La estrecha mayoría ha creado habitualmente dolores de cabeza al presidente de la Cámara, Mike Johnson, a la hora de presentar proyectos de ley, como demostró la reciente aprobación de unos presupuestos temporales para evitar el cierre..."
El primer ministro de Canadá dice que la relación histórica con Estados Unidos “ha terminado”,https://elpais.com/internacional/2025-03-27/el-primer-ministro-de-canada-dice-que-la-antigua-relacion-con-estados-unidos-ha-terminado.html,"Los aranceles del 25% a la importación de automóviles anunciados por Donald Trump han caído como una bomba en la vecina Canadá, inmersa en plena campaña electoral para las elecciones del próximo 28 de abril. El primer ministro, Mark Carney, los considera un ""ataque directo"" que hará sufrir al país, según dijo el miércoles. Este jueves, Carney ha dado un discurso solemne que marca un cambio de era en la relación entre dos países vecinos que han sido amigos y aliados durante generaciones. ""La antigua relación que teníamos con Estados Unidos, basada en la integración cada vez mayor de nuestras economías y en una estrecha cooperación en materia de seguridad y militar, ha terminado"", ha dicho Carney. El primer ministro canadiense promete responder con ""acciones comerciales de represalia que tendrán el máximo impacto en Estados Unidos y el mínimo impacto en Canadá"", según ha anunciado, pero sin detallar cuáles son esas medidas. Carney prevé dedicar todo lo que se recaude con los aranceles de represalia a ayudar a los trabajadores afectados por los aranceles de Trump. ""El presidente Trump volvió a imponer aranceles injustificados a nuestro país, violando nuestros acuerdos comerciales vigentes. Esta vez, apuntó a la industria automotriz y a los más de 500.000 canadienses trabajadores y dedicados que esa industria apoya en todo nuestro país"", inició Carney su intervención. ""Entiendo y respeto su objetivo de apoyar a los trabajadores estadounidenses, pero no estoy de acuerdo con él en que esta sea la forma de ayudar. Con el tiempo, se hará evidente que estas acciones terminarán perjudicando a los trabajadores y consumidores estadounidenses. Rechazo cualquier intento de debilitar a Canadá, de desgastarnos, de quebrarnos para que Estados Unidos pueda adueñarse de nosotros. Eso nunca sucederá, y nuestra respuesta a estos últimos aranceles es luchar, es proteger y construir"", ha añadido Carney. El primer ministro canadiense ha informado de que Trump se puso en contacto con él para programar una llamada entre ambos, que se producirá en uno o dos días, según ha dicho. La primera visita internacional de los mandatarios canadienses suele ser a Estados Unidos. Carney, sin embargo, ni siquiera ha hablado por teléfono con Trump desde que asumió el cargo el pasado 14 de marzo. En lugar de ello, prefirió viajar al Reino Unido y Francia y reforzar sus lazos de amistad. La llamada, según ha anticipado, se producirá en un día o dos. ""Agradezco esta oportunidad para discutir cómo podemos proteger a nuestros trabajadores y construir nuestras economías. Le dejaré claro al presidente que esos intereses se sirven mejor con la cooperación y el respeto mutuo, incluyendo nuestra soberanía"", ha dicho Carney. El de Carney ha sido un discurso algo dramático. ""Para mis conciudadanos canadienses, no quiero crear expectativas poco razonables. El camino por delante será largo. No hay una bala de plata, no hay una solución rápida, y sé y entiendo que muchos se sienten ansiosos y preocupados por el futuro"", ha dicho, tratando de lanzar también mensajes de optimismo: ""Somos más fuertes cuando estamos..."
Los fabricantes de coches se desploman en Bolsa por los aranceles de Trump,https://elpais.com/economia/2025-03-27/los-fabricantes-de-coches-se-desploman-en-bolsa-por-los-aranceles-de-trump.html,"Las acciones de las principales empresas fabricantes de automóviles caen con fuerza en Bolsa tras la decisión del presidente de Estados Unidos, Donald Trump, de imponer aranceles del 25% a los vehículos ligeros importados y sus componentes. La medida supone una disrupción en la cadena de suministros de las grandes empresas del motor estadounidenses. También es un golpe para otros fabricantes internacionales para los que Estados Unidos es un mercado relevante. Las cotizaciones de empresas como General Motors, Ford y Stellantis ya habían caído con fuerza durante el horario regular de la sesión, pero sus pérdidas se han acentuado después de conocerse los detalles de la decisión de Trump. También otras multinacionales del motor cotizadas en Estados Unidos, como Toyota, han caído con fuerza. Tras haber caído más de un 3% durante la sesión, las acciones de General Motors retroceden cerca de otro 7% fuera del horario habitual. Ford resistió durante la sesión, pero caía cerca de un 5% en las operaciones posteriores. Stellantis cede un 7% en el conjunto de la jornada. Incluso Tesla, en principio beneficiada, ha caído un 5,58% en la sesión y ampliaba las pérdidas tras el cierre. Las acciones de las japonesas Toyota, Honda, Nissan y Mazda también caían en Tokio este jueves, con descensos cercanos al 2%. Las coreanas Hyundai y Kia han cotizado a la baja este jueves, con descensos superiores al 3%. Las compañías europeas también se han visto golpeadas en Bolsa por los aranceles estadounidenses desde antes de que se conocieran con detalle. El sector del automóvil es el más penalizado del índice Stoxx 600 este jueves, con una caída que empezó siendo mayor pero que se ha moderado al 2%. Entre los valores más castigados destaca el fabricante de componentes Valeo, que cede cerca del 4,5%, seguido de Stellantis y Porsche, que encajan recortes del 4%. Mercedes Benz y BMW pierden alrededor de un 3% y Volkswagen, el 2%. Decenas de miles de millones de dólares de valor de mercado de las empresas del sector se han volatilizado en un solo día con el anuncio de Trump, cuya guerra comercial amenaza con dañar la economía no solo de Estados Unidos, sino de todo el mundo. La confianza de los consumidores estadounidenses se ha hundido, según una encuesta publicada este martes por The Conference Board, la principal referencia en la materia. La Reserva Federal ha rebajado sus previsiones de crecimiento y elevado las de inflación. El arancel del 25% se aplicará a los vehículos de pasajeros importados (sedanes, SUV, crossovers, minivans, furgonetas de carga) y camiones ligeros, así como a las piezas clave de automóviles (motores, transmisiones, piezas del tren motriz y componentes eléctricos). Cabe ampliar los aranceles a piezas adicionales si es necesario, según la Casa Blanca. Los importadores de automóviles en virtud del Tratado entre México, Estados Unidos y Canadá (TMEC) tendrán la oportunidad de certificar su contenido estadounidense y se implementarán sistemas para que el arancel del 25% solo se aplique al valor de su contenido no estadounidense...."
El déficit comercial de Estados Unidos se disparó un 60% en febrero por los aranceles de Trump,https://elpais.com/economia/2025-03-27/el-deficit-comercial-de-estados-unidos-se-disparo-un-60-en-febrero-por-los-aranceles-de-trump.html,"Los aranceles de Donald Trump están teniendo por ahora el efecto contrario al deseado por el mandatario. Las amenazas del presidente de Estados Unidos de imponer altos impuestos a las importaciones de mercancías de todo tipo han provocado una aceleración de las compras. El déficit comercial ya pulverizó récords en enero y en febrero sigue disparado, según los datos provisionales publicados este jueves por la Oficina del Censo de Estados Unidos. Ese desfase contribuye también a lastrar a la economía estadounidense, a la que no le están sentando nada bien las políticas de Trump. El déficit comercial internacional fue de 147.914 millones de dólares en febrero, según los datos con ajuste estacional. Aunque supone una ligera reducción frente a la cifra sin precedentes de enero, es la segunda cifra más alta de la serie histórica y aumenta un 60% frente a los 92.309 millones del mismo mes del año anterior. Las exportaciones de bienes fueron de 178.599 millones de dólares, 4.312 millones de dólares más que hace un año, pero lo que se dispararon fueron las importaciones, que sumaron 326.513 millones de dólares, frente a los 266.596 millones de enero de 2024. El tirón de las importaciones y del déficit se concentra en los suministros industriales (donde se incluye el petróleo), bienes de capital y de consumo. Los datos avanzados por el censo no desglosan la evolución de las importaciones, las exportaciones y el déficit por países, datos que se publicarán más adelante. Los aranceles decretados por el presidente apenas habían entrado en vigor en marzo. Dentro de su errática política comercial, Trump aplazó los gravámenes a los productos mexicanos y canadienses poco antes de que entrasen en vigor, después de haberlos aprobado. En cambio, en el caso de China sí entró en vigor un impuesto del 10% a todas las importaciones antes de que el presidente rectificase y dejase exentos a la mayoría de los envíos, los de menos de 800 dólares, tras provocar el colapso aduanero con su improvisación y falta de preparativos. Trump ha seguido dando pasos adelante y atrás en la guerra comercial que ha declarado a todo el mundo. En marzo entraron en vigor los aranceles del 25% al acero y el aluminio, se aplicó otro 10% adicional a las importaciones chinas (excluidas las de pequeño volumen) y entraron en vigor fugazmente los aranceles a México y Canadá, antes de otra rectificación que dejó exentos hasta el 2 de abril a los productos acogidos al Tratado entré México, Estados Unidos y Canadá (TMEC). Esta misma semana, Trump ha autorizado imponer aranceles del 25% a los productos procedentes de todos los países que compren petróleo a Venezuela y, además, ha aprobado aranceles del 25% a la importación de automóviles y componentes a aplicar desde el 3 de abril con unas mínimas excepciones. El arancel del 25% se aplicará a los vehículos de pasajeros importados (sedanes, SUV, crossovers, minivans, furgonetas de carga) y camiones ligeros, así como a las piezas clave de automóviles (motores, transmisiones, piezas del..."
Trump endurece la guerra comercial con aranceles del 25% a los coches no fabricados en Estados Unidos,https://elpais.com/internacional/2025-03-26/trump-anunciara-este-miercoles-aranceles-a-la-importacion-coches.html,"La guerra comercial se recrudece. El presidente de Estados Unidos, Donald Trump, anunció este miércoles aranceles del 25% a todos los coches y vehículos ligeros importados que entrarán en vigor el 3 de abril. El anuncio de Trump ha ido algo más allá de la literalidad de la norma. ""Lo que vamos a hacer es aplicar un arancel del 25% a todos los coches que no se fabriquen en Estados Unidos"", dijo Trump en el Despacho Oval de la Casa Blanca, calificando la medida de ""muy modesta"". La Casa Blanca ha matizado posteriormente el anuncio de Trump. Los importadores de automóviles en virtud del Tratado entre México, Estados Unidos y Canadá (TMEC) tendrán la oportunidad de certificar su contenido estadounidense y se implementarán sistemas para que el arancel del 25% solo se aplique al valor de su contenido no estadounidense. Las piezas de automóvil que cumplan con el TMEC permanecerán libres de aranceles hasta que el secretario de Comercio, en consulta con la Oficina de Aduanas (CBP), establezca un proceso para aplicar aranceles a su contenido no estadounidense. El arancel del 25% se aplicará a los vehículos de pasajeros importados (sedanes, SUV, crossovers, minivans, furgonetas de carga) y camiones ligeros, así como a las piezas clave de automóviles (motores, transmisiones, piezas del tren motriz y componentes eléctricos). Cabe ampliar los aranceles a piezas adicionales si es necesario, según la Casa Blanca. Poco después de este anuncio sobre los vehículos importados, el presidente amenazó de forma específica con imponer aranceles ""a gran escala"" a la Unión Europea y Canadá en un mensaje en su red social Truth: ""Si la Unión Europea colabora con Canadá para perjudicar económicamente a EE UU., se les impondrán aranceles a gran escala, mucho mayores de lo previsto, para proteger al mejor amigo que ambos países han tenido"". Las Bolsas estadounidenses cayeron con fuerza durante la sesión al conocerse las intenciones de Trump. La caótica política económica y comercial del presidente está aumentando la incertidumbre y haciendo perder fuelle a la economía estadounidense y, con ello, a la de todo el mundo. La confianza de los consumidores se ha desplomado hasta niveles de la pandemia, según los datos publicados este martes por The Conference Board. Los mercados llevan semanas sufriendo. Las agencias de calificación también ven con preocupación las medidas erráticas y contradictorias de Trump. En solo unas semanas, el presidente está malbaratando la herencia recibida de Joe Biden. Los aranceles harán subir los precios de los coches importados, haciéndolos menos competitivos frente a los estadounidenses, cuyos costes a su vez se han encarecido por los aranceles al aluminio y al acero, entre otros. Los ciudadanos tendrán que pagar más, en definitiva. En la actualidad, en torno a la mitad de los coches que se venden en Estados Unidos son importados. Trump espera que sus impuestos a la importación obliguen a las empresas a trasladar más producción a Estados Unidos y atraigan inversión, pero la inseguridad jurídica generada por un Gobierno que toma sus decisiones de forma..."
No hay bien que por Trump no venga,https://elpais.com/eps/2025-03-01/no-hay-bien-que-por-trump-no-venga.html,"No lo entiendo: ¿a qué viene tanto aspaviento? ¿No sabíamos quién era Trump? ¿No habíamos oído sus discursos? ¿No nos habíamos percatado de que no es un político sino un matón? ¿Ignorábamos que, como Putin, solo entiende el lenguaje de la fuerza? ¿Habíamos olvidado que, igual que Putin, desdeña la democracia, y que montó un golpe de Estado? ¿Nadie nos había dicho que aborrece la UE tanto como Putin y que no quiere una Europa unida (de ahí que apoye a los mandatarios europeos que buscan la desarticulación de la UE)? ¿No era evidente que este segundo Trump, rodeado de magnates obsecuentes e imbuidos de tecnoautoritarismo, sería peor que el primero? ¿Desconocíamos su sintonía con Putin, que lo ayudó a llegar por vez primera al poder? ¿Creíamos que iba a amenazar con guerras comerciales suicidas a México y Canadá, pero no a nosotros? ¿No estaba cantado que en Ucrania intentaría apañárselas con su compinche de Moscú sin contar con los europeos, un apaño ideal para la siguiente invasión rusa (próximas estaciones: Moldavia y los países bálticos)? Todo esto y mucho más lo sabíamos muy bien, pero fingíamos no saberlo, y ahora nos damos de bruces con la realidad: no es una hipérbole decir que Trump aspira a la destrucción de la democracia, para lo cual debe romper o jibarizar Europa, el gran bastión de la democracia, y desmontar los organismos internacionales, a fin de abolir un orden mundial basado en reglas y fundar un nuevo orden autoritario, regido por la única ley que respeta: la ley del más fuerte. Esto es lo que hay, y quien no lo ve es porque no quiere verlo. Así que Europa debe responder de inmediato. ¿Cómo? Hay al menos cinco cosas de sentido común. La primera es entender de una vez por todas que una Europa unida —es decir: una Europa federal, capaz de combinar la unidad política con la diversidad lingüística, cultural e identitaria— es la única garantía de la paz, la prosperidad y la democracia en el continente, así como de su relevancia en el mundo. La segunda es asimilar que, como mínimo en Europa, la divisoria fundamental ya no es la que separa la izquierda de la derecha, sino el internacionalismo del nacionalismo, el europeísmo del soberanismo, la apertura mestiza e incluyente del aislamiento purista y excluyente; esto significa que Pedro Sánchez acierta cuando pide al PP que rompa con Vox, pero yerra cuando no hace lo propio con el secesionismo, que está cortado con el mismo patrón que Vox (o peor: Trump se apoya en Vox; Putin, en el secesionismo, incluido el de ERC, cuyo lema —""Por una Europa de las naciones libres""— podría ser de Orbán o Le Pen). Tercero: Europa no debe depender de Estados Unidos, tiene que ser autónoma desde todos los puntos de vista —político, energético, defensivo— y hablar con una única voz en el mundo, clara y potente. Cuarto: urge que Europa cobre conciencia de su propia fortaleza; somos la tercera economía del mundo (la..."
La UE promete una respuesta “firme y proporcionada” a los nuevos aranceles de Trump,https://elpais.com/internacional/2025-03-27/la-ue-promete-una-respuesta-firme-y-proporcionada-a-los-nuevos-aranceles-de-trump.html,"La Comisión Europea ha reiterado este jueves su rechazo a la nueva tanda de aranceles, esta vez sobre los coches, anunciada el miércoles por el presidente de Estados Unidos, Donald Trump. El Ejecutivo comunitario ha asegurado estar listo para dar una respuesta ""firme, robusta y calibrada"" a la medida estadounidense, sin fijar, sin embargo, una fecha para ello.
""Estamos preparados para salvaguardar nuestros intereses económicos y, en caso necesario, daremos una respuesta firme, proporcionada, robusta, bien calibrada y oportuna a cualquier medida injusta y contraproducente de Estados Unidos"", ha advertido el portavoz comunitario para Comercio.
Bruselas ha recibido sin sorpresa, pero con inquietud y enfado, el nuevo anuncio de Trump, quien en la noche del miércoles anunció aranceles del 25% a todos los coches y vehículos ligeros importados, a partir del 3 de abril. Esa semana, además, Washington podría anunciar nuevos aranceles, amenazó Trump. Europa está haciendo ya preparativos para responder a estas medidas, aunque también ha asegurado que se tomará su tiempo para responder, en vista de las imprecisiones que rondan hasta ahora todas las ofensivas comerciales estadounidenses, señalan fuentes comunitarias.
Nada más conocer el anuncio de Washington sobre los automóviles, la presidenta de la Comisión Europea, Ursula von der Leyen, emitió un breve comunicado en el que lamentaba ""profundamente"" una decisión negativa ""para las empresas y consumidores, tanto en la UE como en Estados Unidos"". Esta es una advertencia que Bruselas lleva haciendo desde las primeras amenazas arancelarias de Trump. Pero, hasta ahora, parece haber caído en saco roto, en vista de los nuevos anuncios y de la entrada en vigor de una primera tanda de represalias, contra el aluminio y el acero, que Europa ha prometido responder con aranceles a productos estadounidenses por valor de hasta 26.000 millones de euros.
Bruselas todavía está estudiando la última amenaza arancelaria, pero asegura, una vez más, que no le temblará la mano en su respuesta, por mucho que duela a todas las partes. Eso sí, ha puntualizado el portavoz comunitario, se responderá de forma ""estratégica"".
""Nuestra respuesta tiene que ser muy estratégica. Nosotros no queremos tener que responder, pero, aun a riesgo de sonar como mi hijo de tres años, no somos nosotros los que empezamos esto"", ha recordado.
Mientras prepara su respuesta, Bruselas intenta, a la par, mantener la puerta abierta a una solución negociada. A pesar de que el principal responsable de la Comisión en la materia, el comisario de Comercio, Maros Sefcovic, acabe de realizar esta misma semana un viaje a Washington del que ha regresado con las manos vacías.
""Nuestra prioridad es encontrar una solución negociada que funcione para las dos partes, para la UE y EE UU; una solución que refuerce nuestra relación económica, que es de lejos la más valiosa e importante del mundo"", ha dicho al respecto el portavoz comunitario. ""Queremos incrementar esa relación, no derribarla, y consideramos que las nuevas medidas estadounidenses van totalmente en la dirección contraria"", ha lamentado."
